{
  "version": 1,
  "source_sha256": "2b6ad3c8f0a14e57b9c0d2e4f6a8b0c2d4e6f8a0b2c4d6e8f0a2b4c6d8e0f2a4",
  "payload_hash": "6f1c9d0a5b3e8c2d7f4a9b1c6d0e3f5a8b2c4d6e0f1a3b5c7d9e0f2a4b6c8d0f",
  "payload": {
    "version": 1,
    "catalog": [
      "#proj/alpha",
      "#proj/alpha/beta",
      "#a, b",
      "#标签/子",
      "#emoji🎉",
      "#unused/only-in-catalog"
    ],
    "memos": [
      {
        "memo_id": "88400000-0000-4000-8000-000000000001",
        "tags": ["#proj/alpha", "#proj/alpha/beta", "#a, b"]
      },
      {
        "memo_id": "88400000-0000-4000-8000-000000000002",
        "tags": ["#标签/子", "#outside-not-in-catalog", "#outside-not-in-catalog"]
      },
      {
        "memo_id": "88400000-0000-4000-8000-000000000003",
        "tags": []
      },
      {
        "memo_id": "88400000-0000-4000-8000-000000000004",
        "tags": ["#emoji🎉", "#a, b"]
      }
    ]
  },
  "created_at": "2026-10-16T12:34:56.123456+00:00"
}
